{
 "$schema": "../paket.schema.json",
 "id": "handwerk-montage",
 "titel": "Montage und Kleinreparaturen",
 "beschreibung": "Gründung eines Montage- und Reparaturdienstes für Haushalte aus dem Grundsicherungsgeld.",
 "erfunden": true,
 "werte": {
  "beruf": "Tischler",
  "erfahrung": "seit zwölf Jahren",
  "erfahrungKurz": "zwölf Jahre als Tischler und Monteur",
  "vorhabenKurz": "Möbelmontage und Kleinreparaturen für Haushalte",
  "vorhabenText": "Möbelmontage, Kleinreparaturen und Küchenaufbau für Haushalte, Hausverwaltungen und Möbelhäuser in der Region. Größere Arbeiten, für die eine Eintragung nötig ist, übernehme ich nicht.",
  "kernbotschaft": "Ich bin seit zwölf Jahren Tischler und habe zuletzt als Monteur für ein Möbelhaus gearbeitet. Mein Businessplan ist fertig. Nach meiner Rechnung decke ich ab dem zweiten Jahr meinen Lebensunterhalt selbst. Ich möchte das sauber und mit Ihnen gemeinsam angehen.",
  "stelle": "Handwerkskammer",
  "zuschussZweck": "Werkzeug und Transport",
  "zuschussPosten": [
   {
    "was": "einen Satz Akkuwerkzeug mit Ersatzakkus",
    "kurz": "Akkuwerkzeug",
    "betrag": 1400
   },
   {
    "was": "einen gebrauchten Pkw-Anhänger",
    "kurz": "Anhänger",
    "betrag": 900
   },
   {
    "was": "Schutzausrüstung und Arbeitskleidung",
    "kurz": "Schutzausrüstung",
    "betrag": 200
   }
  ],
  "kostenMonat": 420,
  "umsatz": [
   32000,
   46000,
   54000
  ],
  "gewinn": [
   22000,
   33000,
   39000
  ],
  "schwelleMonat": 2300,
  "fruehwarn": 4000,
  "kapitalbedarf": 3200,
  "ausstieg": "12 bis 15",
  "arbeitszeit": "40 Stunden pro Woche",
  "arbeitszeitAufteilung": "etwa 70 % Einsätze bei Kunden, 15 % Fahrten und Einkauf, 15 % Angebote und Verwaltung",
  "rechtsform": "Einzelunternehmen, Gewerbe",
  "anmeldung": "Gewerbeanmeldung beim Gewerbeamt",
  "steuer": "Ab dem zweiten Jahr rechne ich mit Umsatzsteuer und plane die Preise netto.",
  "angebotKurz": "Möbel- und Küchenmontage zum Stundensatz (48 €/Stunde plus Anfahrt), Kleinreparaturen als Pauschale, Rahmenverträge mit Hausverwaltungen",
  "vorbereitet": "Businessplan, Preisliste, Kostenvoranschläge, Gespräche mit zwei Hausverwaltungen",
  "vorbereitungBeispiel": "Preisliste",
  "belege": "Fotos fertiger Arbeiten und Arbeitszeugnisse",
  "belegEinzeln": "Fotos einer aufgebauten Küche",
  "agendaZeigen": "Fotos fertiger Arbeiten, Preisliste",
  "wiederkehrend": "Rahmenverträge mit Hausverwaltungen",
  "anpassung": "mehr Einsätze für Möbelhäuser oder eine Teilzeitstelle als Monteur",
  "vorsichtigeAnnahme": "Gerechnet sind nur 15 bezahlte Einsatzstunden pro Woche im ersten Jahr, der Rest geht für Fahrten und Aufbau der Kundschaft drauf.",
  "einfachErklaert": "Ich baue Möbel und Küchen auf und repariere Kleinigkeiten in Wohnungen, für Privatleute und für Hausverwaltungen.",
  "abgrenzung": "Möbelhäuser vergeben Montage an Subunternehmer mit langen Wartezeiten, Plattformen vermitteln oft ungelernte Helfer. Ich bin ausgebildeter Tischler, komme innerhalb einer Woche und gebe einen Festpreis vor Beginn."
 },
 "ueberschreiben": {
  "fragen/kunden": {
   "a": "Privathaushalte, die Möbel oder Küchen aufbauen lassen, und Hausverwaltungen, die kleine Reparaturen in Wohnungen vergeben. Mit zwei Hausverwaltungen habe ich gesprochen [Ergebnis eintragen]; feste Aufträge nehme ich erst nach der Gewerbeanmeldung an."
  },
  "fragen/kundengewinnung": {
   "a": "Über Aushänge und Anzeigen im Viertel, Empfehlungen, ein Profil auf einer Handwerkerplattform und direkte Ansprache von Hausverwaltungen. Rahmenverträge mit Hausverwaltungen bauen wiederkehrende Einnahmen auf."
  },
  "fragen/genehmigung": {
   "a": "Gewerbeanmeldung vor dem ersten Auftrag. Bei der Handwerkskammer habe ich klären lassen, welche meiner Arbeiten zulassungsfrei sind [Ergebnis eintragen]; alles andere biete ich nicht an. Eine Betriebshaftpflicht schließe ich ab."
  },
  "fragen/zahlungsausfall": {
   "a": "Bei Privatkunden kassiere ich nach dem Einsatz sofort, bar oder per Karte. Größere Aufträge laufen mit Abschlag beim Materialeinkauf. Hausverwaltungen zahlen nach Rechnung; dort mahne ich nach festem Ablauf."
  },
  "fragen/krank": {
   "a": "Termine plane ich mit Puffer und sage rechtzeitig ab. Für längere Ausfälle bin ich krankenversichert, und ich prüfe eine Unfallversicherung, weil meine Arbeit körperlich ist; das Risiko steht im Plan."
  }
 },
 "fragen": [
  {
   "id": "anhaenger",
   "nach": "zuschuss",
   "c": "Zahlen",
   "q": "Warum ein Anhänger und kein Transporter?",
   "a": "Ein gebrauchter Anhänger kostet einen Bruchteil und hat kaum laufende Kosten. Für Küchen und große Möbel reicht er. Einen Transporter miete ich tageweise, wenn ein Auftrag es braucht; das ist im Plan eingerechnet.",
   "show": "Kostenvoranschlag, Businessplan Abschnitt 7",
   "laws": [
    "sgb2_16c1"
   ]
  },
  {
   "id": "koerperlich",
   "nach": "krank",
   "c": "Nachfragen",
   "q": "Die Arbeit ist körperlich schwer. Halten Sie das durch?",
   "a": "Ich habe die Arbeit zwölf Jahre gemacht. Ich plane 15 bezahlte Stunden pro Woche im ersten Jahr und keine Arbeiten über Kopf am Fließband wie früher. Schweres trage ich zu zweit; dafür buche ich bei Bedarf eine Aushilfe.",
   "show": "Businessplan Abschnitt 11 (Risiken)",
   "laws": []
  },
  {
   "id": "schwarzarbeit",
   "nach": "angebot",
   "c": "Angebot",
   "q": "Viele machen das schwarz. Warum sollte jemand Ihre Preise zahlen?",
   "a": "Weil Kunden eine Rechnung brauchen, etwa für die Steuer oder die Hausverwaltung, und weil ich versichert bin, wenn etwas kaputtgeht. Hausverwaltungen vergeben gar nicht ohne Rechnung.",
   "show": "Preisliste, Versicherungsnachweis",
   "laws": []
  }
 ],
 "pruefpunkte": [
  "Zulassungspflichtig, zulassungsfrei oder handwerksähnlich? Klären Sie bei der Handwerkskammer, welche Arbeiten Sie ohne Eintragung anbieten dürfen, und bieten Sie nur diese an.",
  "Betriebshaftpflicht, die Schäden in Kundenwohnungen abdeckt.",
  "Unfallversicherung: Fragen Sie bei der zuständigen Berufsgenossenschaft nach, ob Sie sich als Unternehmer versichern müssen oder können.",
  "Fahrzeug und Anhänger: Führerscheinklasse und Gesamtgewicht vor dem Kauf prüfen."
 ],
 "mitbringen": [
  "Businessplan, zweimal ausgedruckt (eins zum Dalassen)",
  "Gesellenbrief, Arbeitszeugnisse und Lebenslauf",
  "Kostenvoranschläge für Akkuwerkzeug, Anhänger, Schutzausrüstung",
  "Stellungnahme der Handwerkskammer zur Tragfähigkeit (oder Terminbestätigung)",
  "Ergebnis der Handwerkskammer, welche Arbeiten zulassungsfrei sind",
  "Fotos fertiger Arbeiten, Preisliste",
  "Personalausweis, BG-Nummer, Kopie Ihres Antrags mit Eingangsbestätigung",
  "Block und Stift; Beistand, falls gewünscht"
 ]
}
