{
 "$schema": "../paket.schema.json",
 "id": "onlinehandel",
 "titel": "Onlinehandel mit gebrauchten Büchern",
 "beschreibung": "Gründung eines Onlinehandels mit gebrauchten Fach- und Sachbüchern aus dem Grundsicherungsgeld.",
 "erfunden": true,
 "werte": {
  "beruf": "Buchhändler",
  "erfahrung": "seit zehn Jahren",
  "erfahrungKurz": "zehn Jahre im Buchhandel, davon drei im Versand",
  "vorhabenKurz": "gebrauchte Fachbücher online verkaufen",
  "vorhabenText": "Onlinehandel mit gebrauchten Fach- und Sachbüchern über einen eigenen Shop und zwei Marktplätze. Ankauf aus Haushaltsauflösungen, Bibliotheksabgaben und von Studierenden.",
  "kernbotschaft": "Ich arbeite seit zehn Jahren im Buchhandel, davon drei Jahre im Versand. Mein Businessplan ist fertig, ein Lagerraum ist in Aussicht. Nach meiner Rechnung decke ich ab dem zweiten Jahr meinen Lebensunterhalt selbst. Ich möchte das sauber und mit Ihnen gemeinsam angehen.",
  "stelle": "IHK",
  "zuschussZweck": "Lager- und Versandausstattung",
  "zuschussPosten": [
   {
    "was": "Regale für das Lager",
    "kurz": "Regale",
    "betrag": 600
   },
   {
    "was": "einen Laptop mit Scanner für die Erfassung",
    "kurz": "Laptop und Scanner",
    "betrag": 900
   },
   {
    "was": "einen Etikettendrucker",
    "kurz": "Etikettendrucker",
    "betrag": 250
   },
   {
    "was": "eine Paketwaage",
    "kurz": "Paketwaage",
    "betrag": 60
   }
  ],
  "kostenMonat": 380,
  "umsatz": [
   30000,
   48000,
   60000
  ],
  "gewinn": [
   15000,
   28000,
   36000
  ],
  "schwelleMonat": 2200,
  "fruehwarn": 3000,
  "kapitalbedarf": 4500,
  "ausstieg": "16 bis 19",
  "arbeitszeit": "40 Stunden pro Woche",
  "arbeitszeitAufteilung": "etwa 40 % Ankauf und Erfassung, 35 % Versand, 25 % Kundenanfragen und Verwaltung",
  "rechtsform": "Einzelunternehmen, Gewerbe",
  "anmeldung": "Gewerbeanmeldung beim Gewerbeamt",
  "steuer": "Ab dem zweiten Jahr rechne ich mit Umsatzsteuer; die Regeln für gebrauchte Ware kläre ich mit dem Finanzamt.",
  "angebotKurz": "Gebrauchte Fach- und Sachbücher (Durchschnittspreis 14 €), Ankauf ganzer Sammlungen, Suchdienst für vergriffene Titel",
  "vorbereitet": "Businessplan, Angebot für einen Lagerraum, Testverkäufe aus eigenem Bestand, Absprache mit zwei Ankaufquellen",
  "vorbereitungBeispiel": "Testverkäufe",
  "belege": "Arbeitszeugnisse und die Auswertung der Testverkäufe",
  "belegEinzeln": "die Auswertung der Testverkäufe",
  "agendaZeigen": "Auswertung der Testverkäufe, Kalkulation pro Buch",
  "wiederkehrend": "Stammkunden und Suchaufträge",
  "anpassung": "mehr Ankauf über Bibliotheken oder eine Teilzeitstelle im Versand",
  "vorsichtigeAnnahme": "Gerechnet sind 180 verkaufte Bücher pro Monat im ersten Jahr, halb so viele wie in den Testverkäufen, und Plattformgebühren von 15 %.",
  "einfachErklaert": "Ich kaufe gebrauchte Fachbücher günstig an und verkaufe sie online an Studierende und Fachleute.",
  "abgrenzung": "Große Plattformen kaufen Bücher nach Barcode zu Centpreisen an und sortieren vieles aus. Ich kenne mich mit Fachbüchern aus, beschreibe den Zustand genau und finde auch ältere Ausgaben ohne Barcode."
 },
 "ueberschreiben": {
  "fragen/kunden": {
   "a": "Studierende, Fachleute und Sammler, die ein bestimmtes Buch suchen. Sie kaufen über meinen Shop und zwei Marktplätze. Testverkäufe aus eigenem Bestand zeigen die Nachfrage [Zahlen eintragen]."
  },
  "fragen/kundengewinnung": {
   "a": "Über die Marktplätze, auf denen die Kunden schon suchen, einen eigenen Shop mit Suchdienst und Aushänge an Hochschulen für den Ankauf. Stammkunden und Suchaufträge bauen wiederkehrende Einnahmen auf."
  },
  "fragen/genehmigung": {
   "a": "Gewerbeanmeldung vor dem ersten Verkauf. Vor dem ersten Versand registriere ich mich im Verpackungsregister und schließe einen Vertrag mit einem Entsorgungssystem ab. Impressum, Widerrufsbelehrung und Datenschutzerklärung lasse ich prüfen [Stelle eintragen]."
  },
  "fragen/zahlungsausfall": {
   "a": "Online wird vor dem Versand bezahlt. Bei Rechnungskauf für Bibliotheken liefere ich erst nach der ersten bezahlten Bestellung auf Rechnung."
  },
  "fragen/schulden": {
   "a": "[Wahrheitsgemäß, kurz.] Für das Geschäft nehme ich keinen Kredit auf. Der Kapitalbedarf von 4.500 € ist vor allem der erste Warenbestand; ihn kaufe ich schrittweise aus den Verkäufen nach."
  }
 },
 "fragen": [
  {
   "id": "ware",
   "nach": "umsatz",
   "c": "Zahlen",
   "q": "Woher bekommen Sie genug Bücher?",
   "a": "Aus Haushaltsauflösungen, von Bibliotheken, die Bestände abgeben, und von Studierenden am Semesterende. Mit zwei Quellen habe ich abgesprochen, dass ich regelmäßig ankaufe [Stand eintragen].",
   "show": "Absprachen mit Ankaufquellen, Businessplan Abschnitt 5",
   "laws": []
  },
  {
   "id": "plattform",
   "nach": "konkurrenz",
   "c": "Kunden & Markt",
   "q": "Was, wenn die Plattform Sie sperrt oder die Gebühren erhöht?",
   "a": "Deshalb verkaufe ich über zwei Marktplätze und einen eigenen Shop. Kein Kanal soll mehr als die Hälfte des Umsatzes bringen; das steht als Ziel im Plan.",
   "show": "Businessplan Abschnitt 11 (Risiken)",
   "laws": []
  },
  {
   "id": "lager",
   "nach": "zuschuss",
   "c": "Zahlen",
   "q": "Brauchen Sie dafür wirklich ein Lager?",
   "a": "Bei 2.000 Büchern im Bestand reicht die Wohnung nicht, und Ware in der Wohnung vermischt Geschäft und Haushalt. Der Lagerraum kostet 150 € im Monat und steckt in den laufenden Kosten.",
   "show": "Angebot für den Lagerraum",
   "laws": [
    "sgb2_16c1"
   ]
  }
 ],
 "pruefpunkte": [
  "Verpackungsregister: Vor dem ersten Versand registrieren und einen Vertrag mit einem Entsorgungssystem für Versandverpackungen abschließen.",
  "Rechtstexte für den Shop (Impressum, Widerrufsbelehrung, Datenschutzerklärung) prüfen lassen, z. B. über die IHK oder einen Händlerbund.",
  "Umsatzsteuer auf gebrauchte Ware: Besondere Regeln beim Finanzamt erfragen.",
  "Plattformbedingungen: Gebühren und Regeln für gewerbliche Händler vor dem Start lesen."
 ],
 "mitbringen": [
  "Businessplan, zweimal ausgedruckt (eins zum Dalassen)",
  "Lebenslauf und Arbeitszeugnisse",
  "Kostenvoranschläge für Regale, Laptop und Scanner, Etikettendrucker, Paketwaage",
  "Stellungnahme der IHK zur Tragfähigkeit (oder Terminbestätigung)",
  "Auswertung der Testverkäufe, Angebot für den Lagerraum",
  "Absprachen mit Ankaufquellen, falls schriftlich",
  "Personalausweis, BG-Nummer, Kopie Ihres Antrags mit Eingangsbestätigung",
  "Block und Stift; Beistand, falls gewünscht"
 ]
}
