{
 "$schema": "../paket.schema.json",
 "id": "leer",
 "titel": "Leeres Paket",
 "beschreibung": "Vorlage zum Ausfüllen für die eigene Gründung.",
 "erfunden": false,
 "werte": {
  "beruf": "",
  "erfahrung": "",
  "erfahrungKurz": "",
  "vorhabenKurz": "",
  "vorhabenText": "",
  "kernbotschaft": "",
  "stelle": "",
  "zuschussZweck": "",
  "ausstieg": "",
  "arbeitszeit": "",
  "arbeitszeitAufteilung": "",
  "rechtsform": "",
  "anmeldung": "",
  "steuer": "",
  "angebotKurz": "",
  "vorbereitet": "",
  "vorbereitungBeispiel": "",
  "belege": "",
  "belegEinzeln": "",
  "agendaZeigen": "",
  "wiederkehrend": "",
  "anpassung": "",
  "vorsichtigeAnnahme": "",
  "einfachErklaert": "",
  "abgrenzung": "",
  "zuschussPosten": [],
  "kostenMonat": null,
  "umsatz": [
   null,
   null,
   null
  ],
  "gewinn": [
   null,
   null,
   null
  ],
  "schwelleMonat": null,
  "fruehwarn": null,
  "kapitalbedarf": null
 },
 "pruefpunkte": [
  "Welche Stelle bescheinigt die Tragfähigkeit (IHK, Handwerkskammer, Gründungsberatung)? Beim Jobcenter erfragen.",
  "Gewerbe oder freier Beruf? Im Zweifel entscheidet das Finanzamt."
 ]
}